"type","abstract","AB","title","author","doi","journal","link","M1","M2","tow","note","year","url","vol","access","endref","cond","nber_is_published","nber_in_ssrn"
"JOUR","We propose a new valuation method for private equity investments. First, we construct a cash-flow replicating portfolio for the private investment, applying Machine Learning techniques on cash-flows on various listed equity and fixed income instruments. The second step values the replicating portfolio using a flexible asset pricing model that accurately prices the systematic risk in bonds of different maturities and a broad cross-section of equity factors. The method delivers a measure of the risk-adjusted profit earned on a PE investment and a time series for the expected return on PE fund categories. We apply the method to buyout, venture capital, real estate, and infrastructure funds, among others. Accounting for horizon-dependent risk and exposure to a broad cross-section of equity factors results in negative average risk-adjusted profits. Substantial cross-sectional variation and persistence in performance suggests some funds outperform. We also find declining expected returns on PE funds in the later part of the sample.",NA,"valuing private equity strip by strip","van nieuwerburgh, stijn","10.3386/w26514","National Bureau of Economic Research Working Paper Series","http://www.nber.org/papers/w26514.pdf",NA,NA,NA,"Author contact info: Arpit Gupta E-Mail: arpit.gupta@stern.nyu.edu  Stijn Van Nieuwerburgh Columbia University Graduate School of Business Kravis Hall, office 796 665 West 130th Street New York, NY 10027 E-Mail: svnieuwe@gsb.columbia.edu",2019,"http://www.nber.org/papers/w26514","No. 26514","Nov-19",NA,TRUE,FALSE,FALSE
"JOUR","Social media data presents challenges for forecasters since one must convert text into data and deal with issues related to these measures being collected at different frequencies and volumes than traditional financial data. In this paper, we use a deep learning algorithm to measure sentiment within Twitter messages on an hourly basis and introduce a new method to undertake MIDAS that allows for a weaker discounting of historical data that is well-suited for this new data source. To evaluate the performance of approach relative to alternative MIDAS strategies, we conduct an out of sample forecasting exercise for the consumer confidence index with both traditional econometric strategies and machine learning algorithms. Irrespective of the estimator used to conduct forecasts, our results show that (i) including consumer sentiment measures from Twitter greatly improves forecast accuracy, and (ii) there are substantial gains from our proposed MIDAS procedure relative to common alternatives.",NA,"does high frequency social media data improve forecasts of low frequency consumer confidence measures?","zeng, tao","10.3386/w26505","National Bureau of Economic Research Working Paper Series","http://www.nber.org/papers/w26505.pdf",NA,NA,NA,"Author contact info: Steven F. Lehrer Dunning Hall 336, 94 University Avenue Department of Economics Queen's University Kingston, Ontario K7L 3N6 E-Mail: lehrers@queensu.ca  Tian Xie Rm.424 College of Business Shanghai University of Finance and Economics Shanghai, China, 200433 E-Mail: xietian001@hotmail.com  Tao Zeng 216-3, Waijingmao Building Department of Economics Zhejiang University Hangzhou 310058 China E-Mail: ztzt6512@gmail.com",2019,"http://www.nber.org/papers/w26505","No. 26505","Nov-19",NA,TRUE,FALSE,FALSE
"JOUR","We benchmark seven global optimization algorithms by comparing their performance on challenging multidimensional test functions as well as a method of simulated moments estimation of a panel data model of earnings dynamics. Five of the algorithms are taken from the popular NLopt open-source library: (i) Controlled Random Search with local mutation (CRS), (ii) Improved Stochastic Ranking Evolution Strategy (ISRES), (iii) Multi-Level Single-Linkage (MLSL) algorithm, (iv) Stochastic Global Optimization (StoGo), and (v) Evolutionary Strategy with Cauchy distribution (ESCH). The other two algorithms are versions of TikTak, which is a multistart global optimization algorithm used in some recent economic applications. For completeness, we add three popular local algorithms to the comparison—the Nelder-Mead downhill simplex algorithm, the Derivative-Free Non-linear Least Squares (DFNLS) algorithm, and a popular variant of the Davidon-Fletcher-Powell (DFPMIN) algorithm. To give a detailed comparison of algorithms, we use a set of benchmarking tools recently developed in the applied mathematics literature. We find that the success rate of many optimizers vary dramatically with the characteristics of each problem and the computational budget that is available. Overall, TikTak is the strongest performer on both the math test functions and the economic application. The next-best performing optimizers are StoGo and CRS for the test functions and MLSL for the economic application.",NA,"benchmarking global optimizers","kleineberg, tatjana","10.3386/w26340","National Bureau of Economic Research Working Paper Series","http://www.nber.org/papers/w26340.pdf",NA,NA,NA,"Author contact info: Antoine Arnoud Yale University E-Mail: antoine.arnoud@yale.edu  Fatih Guvenen Department of Economics University of Minnesota 4-101 Hanson Hall 1925 Fourth Street South Minneapolis, MN, 55455 Tel:  612-6250767 E-Mail: guvenen@umn.edu  Tatjana Kleineberg The World Bank E-Mail: tkleineberg@worldbank.org",2019,"http://www.nber.org/papers/w26340","No. 26340","Oct-19",NA,TRUE,FALSE,FALSE
"JOUR","Products often bundle together many functions e.g., smartphones. The firm develops the big idea (which functions to bundle) and then chooses one supplier per function. We develop a model featuring holdup in which the firm's bargaining power declines in the number of suppliers. Greater scope as measured by the number of suppliers exacerbates holdup, but this is partially offset by the appropriate choice of vertical integration or outsourcing. Our main result flows from the empirical observation that the number of functions varies across products within an industry (firm heterogeneity). We introduce the notion of an 'ideas-oriented' industry in which more productive firms have higher marginal returns to introducing a new function. We show that more productive firms will (1) have more suppliers and (2) be more likely to integrate those suppliers. We take this to the data using a neural network to predict whether or not each of 29 million PATSTAT patent applications involves new/improved functions. We merge these patents with Capital IQ data on 55,000 companies and their supplier networks. We show that in industries where patents are skewed towards new or improved functions, more productive firms have more suppliers and are more likely to integrate these suppliers.",NA,"what's the big idea? multi-function products, firm scope and firm boundaries","trefler, daniel","10.3386/w26320","National Bureau of Economic Research Working Paper Series","http://www.nber.org/papers/w26320.pdf",NA,NA,NA,"Author contact info: Mengxiao Liu Department of Economics Maxwell School of Citizenship and Public Affairs Syracuse University 110 Eggers Hall Syracuse, NY 13244 E-Mail: mengxiaoliu@gmail.com  Daniel Trefler Rotman School of Management University of Toronto 105 St. George Street Toronto, ON M5S 3E6 Tel: 416/946-7945 Fax: 416/978-5433 E-Mail: dtrefler@rotman.utoronto.ca",2019,"http://www.nber.org/papers/w26320","No. 26320","Sep-19",NA,TRUE,FALSE,FALSE
"JOUR","This paper investigates how, in a heterogeneous agents model with financial frictions,  idiosyncratic individual shocks interact with exogenous aggregate shocks to generate time-varying levels of leverage and endogenous aggregate risk. To do so, we show how such a model can be efficiently computed, despite its substantial nonlinearities, using tools from machine learning. We also illustrate how the model can be structurally estimated with a likelihood function, using tools from inference with diffusions. We document, first, the strong nonlinearities created by financial frictions. Second, we report the existence of multiple stochastic steady states with properties that differ from the deterministic steady state along important dimensions. Third, we illustrate how the generalized impulse response functions of the model are highly state-dependent. In particular, we find that the recovery after a negative aggregate shock is more sluggish when the economy is more leveraged. Fourth, we prove that wealth heterogeneity matters in this economy because of the asymmetric responses of household consumption decisions to aggregate shocks.",NA,"financial frictions and the wealth distribution","nuño, galo","10.3386/w26302","National Bureau of Economic Research Working Paper Series","http://www.nber.org/papers/w26302.pdf",NA,NA,NA,"Author contact info: Jesús Fernández-Villaverde Department of Economics University of Pennsylvania The Ronald O. Perelman Center  for Political Science and Economics 133 South 36th Street Suite 150 Philadelphia, PA 19104 E-Mail: jesusfv@econ.upenn.edu  Samuel Hurtado Banco de España Alcalá 48, 28014 Madrid Spain E-Mail: samuel.hurtado@bde.es  Galo Nuño Bank of Spain and BIS Spain E-Mail: galonunobarrau@gmail.com",2019,"http://www.nber.org/papers/w26302","No. 26302","Sep-19",NA,TRUE,FALSE,FALSE
"JOUR","The solar industry in the US typically uses a credit score such as the FICO score as an indicator of consumer utility payment performance and credit worthiness to approve customers for new solar installations. Using data on over 800,000 utility payment performance and over 5,000 demographic variables, we compare machine learning and econometric models to predict the probability of default to credit-score cutoffs. We compare these models across a variety of measures, including how they affect consumers of different socio-economic backgrounds and profitability. We find that a traditional regression analysis using a small number of variables specific to utility repayment performance greatly increases accuracy and LMI inclusivity relative to FICO score, and that using machine learning techniques further enhances model performance. Relative to FICO, the machine learning model increases the number of low-to-moderate income consumers approved for community solar by 1.1% to 4.2% depending on the stringency used for evaluating potential customers, while decreasing the default rate by 1.4 to 1.9 percentage points. Using electricity utility repayment as a proxy for solar installation repayment, shifting from a FICO score cutoff to the machine learning model increases profits by 34% to 1882% depending on the stringency used for evaluating potential customers.",NA,"machine learning for solar accessibility: implications for low-income solar expansion and profitability","roache, kelly","10.3386/w26178","National Bureau of Economic Research Working Paper Series","http://www.nber.org/papers/w26178.pdf",NA,NA,NA,"Author contact info: Sruthi Davuluri Center for Energy and Environmental Policy Researc 77 Massachusetts Avenue Cambridge, MA 02139 E-Mail: sruthi@mit.edu  René García Franceschini 77 Massachusetts Ave Cambridge, MA 02139 E-Mail: ragarcia@mit.edu  Christopher R. Knittel MIT Sloan School of Management 100 Main Street, E62-513 Cambridge, MA 02142 E-Mail: knittel@mit.edu  Chikara Onda Stanford University Stanford, CA 94305 E-Mail: conda@stanford.edu  Kelly Roache Energy and Policy Institute E-Mail: kellyroache@gmail.com",2019,"http://www.nber.org/papers/w26178","No. 26178","Sep-19",NA,TRUE,FALSE,FALSE
"JOUR","A key challenge for research on many questions in the social sciences is that it is difficult to link historical records in a way that allows investigators to observe people at different points in their life or across generations.  In this paper, we develop a new approach that relies on millions of record links created by individual contributors to a large, public, wiki-style family tree.  First, we use these “true” links to inform the decisions one needs to make when using traditional linking methods.  Second, we use the links to construct a training data set for use in supervised machine learning methods.  We describe the procedure we use and illustrate the potential of our approach by linking individuals across the 100% samples of the US decennial censuses from 1900, 1910, and 1920.  We obtain an overall match rate of about 70 percent, with a false positive rate of about 12 percent.  This combination of high match rate and accuracy represents a point beyond the current frontier for record linking methods.",NA,"combining family history and machine learning to link historical records","riley, isaac","10.3386/w26227","National Bureau of Economic Research Working Paper Series","http://www.nber.org/papers/w26227.pdf",NA,NA,NA,"Author contact info: Joseph Price Department of Economics Brigham Young University 2129 WVB Provo, UT 84602 Tel: 801/422-5296 Fax: 801/422-0194 E-Mail: joseph_price@byu.edu  Kasey Buckles University of Notre Dame Department of Economics 3052 Jenkins-Nanovic Halls Notre Dame, IN 46556 E-Mail: kbuckles@nd.edu  Jacob R. Van Leeuwen 2935 Research Parkway College Station, TX 77845 Tel: 8017211165 E-Mail: jacobrvl@gmail.com  Isaac Riley Record Linking Lab Brigham Young University 435 Crabtree Technology Building Provo, UT 84602 E-Mail: isaac.r.riley@gmail.com",2019,"http://www.nber.org/papers/w26227","No. 26227","Sep-19",NA,TRUE,FALSE,FALSE
"JOUR","We use machine learning as a tool to study decision making, focusing specifically on how physicians diagnose heart attack. An algorithmic model of a patient’s probability of heart attack allows us to identify cases where physician testing decisions deviate from predicted risk. We then use actual health outcomes to evaluate whether those deviations represent mistakes or physicians’ superior knowledge. This approach reveals two inefficiencies. Physicians over-test: predictably low-risk patients are tested, but do not benefit. At the same time, physicians undertest: predictably high-risk patients are left untested, and then go on to suffer adverse health events including death. A natural experiment using shift-to-shift testing variation confirms these findings. Simultaneous over- and under-testing cannot easily be explained by incentives alone, and instead point to systematic errors in judgment. We provide suggestive evidence on the psychology underlying these errors. First, physicians use too simple a model of risk. Second, they overweight factors that are salient or representative of heart attack, such as chest pain. We argue health care models must incorporate physician error, and illustrate how policies focused solely on incentive problems can produce large inefficiencies.",NA,"diagnosing physician error: a machine learning approach to low-value health care","obermeyer, ziad","10.3386/w26168","National Bureau of Economic Research Working Paper Series","http://www.nber.org/papers/w26168.pdf",NA,NA,NA,"Author contact info: Sendhil Mullainathan Booth School of Business University of Chicago 5807 South Woodlawn Avenue Chicago, IL 60637 Tel: 773/834-2353 E-Mail: sendhil.mullainathan@gmail.com  Ziad Obermeyer School of Public Health University of California, Berkeley 2121 Berkeley Way Berkeley, CA 94704 E-Mail: zobermeyer@berkeley.edu",2019,"http://www.nber.org/papers/w26168","No. 26168","Aug-19",NA,TRUE,FALSE,FALSE
"JOUR","We develop a  model to predict consumer default based on deep learning. We show that the model consistently outperforms standard credit scoring models, even though it uses the same data. Our model is interpretable and is able to provide a score to a larger class of borrowers relative to standard credit scoring models while accurately tracking variations in systemic risk. We argue that these properties can provide valuable insights for the design of policies targeted at reducing consumer default and alleviating its burden on borrowers and lenders, as well as macroprudential regulation.",NA,"predicting consumer default: a deep learning approach","vamossy, domonkos f","10.3386/w26165","National Bureau of Economic Research Working Paper Series","http://www.nber.org/papers/w26165.pdf",NA,NA,NA,"Author contact info: Stefania Albanesi Miami Herbert Business School University of Miami 5250 University Drive Coral Gables, FL 33146 E-Mail: stefania.albanesi@gmail.com  Domonkos F. Vamossy 230 S Bouquet St Department of Economics, University of Pittsburgh Pittsburgh, PA 15260 United States Tel: 2023943452 E-Mail: d.vamossy@pitt.edu",2019,"http://www.nber.org/papers/w26165","No. 26165","Aug-19",NA,TRUE,FALSE,FALSE
"JOUR","We test the effectiveness of an entertainment education TV series, MTV Shuga, aimed at providing information and changing attitudes and behaviors related to HIV/AIDS. Using a simple model we show that ""edutainment"" can work through an individual or a social channel. We conducted a randomized controlled trial in urban Nigeria where young viewers were exposed to MTV Shuga or to a placebo TV series. Among those exposed to MTV Shuga, we created additional variation in the social messages they received and in the people with whom they watched the show. We find significant improvements in knowledge and attitudes towards HIV and risky sexual behavior. Treated subjects are twice as likely to get tested for HIV eight months after the intervention. We also find reductions in STDs among women. These effects are stronger for viewers who report being more involved with the narrative, consistent with the psychological underpinnings of edutainment. Our experimental manipulations of the social norm component did not produce significantly different results from the main treatment. The individual effect of edutainment thus seems to have prevailed in the context of our study.",NA,"the entertaining way to behavioral change: fighting hiv with mtv","orozco-olvera, victor h","10.3386/w26096","National Bureau of Economic Research Working Paper Series","http://www.nber.org/papers/w26096.pdf",NA,NA,NA,"Author contact info: Abhijit Banerjee Department of Economics, E52-540 MIT 77 Massachusetts Avenue Cambridge, MA 02139 Tel: 617/253-8855 Fax: 617/253-1330 E-Mail: banerjee@mit.edu  Eliana La Ferrara Harvard Kennedy School 79 JFK Street Cambridge, MA 02138 Tel: 617/496-6256 E-Mail: elaferrara@hks.harvard.edu  Victor H. Orozco-Olvera World Bank Development Impact Evaluation Department (DIME) 1818 H Street Washington, DC 20433 E-Mail: vorozco@worldbank.org",2019,"http://www.nber.org/papers/w26096","No. 26096","Jul-19",NA,TRUE,FALSE,FALSE
"JOUR","Policymakers can take actions to prevent local conflict before it begins, if such violence can be accurately predicted. We examine the two countries with the richest available sub-national data: Colombia and Indonesia. We assemble two decades of fine-grained violence data by type, alongside hundreds of annual risk factors. We predict violence one year ahead with a range of machine learning techniques. Models reliably identify persistent, high-violence hot spots. Violence is not simply autoregressive, as detailed histories of disaggregated violence perform best. Rich socio-economic data also substitute well for these histories. Even with such unusually rich data, however, the models poorly predict new outbreaks or escalations of violence. ""Best case"" scenarios with panel data fall short of workable early-warning systems.",NA,"the promise and pitfalls of conflict prediction: evidence from colombia and indonesia","peck, richard merton","10.3386/w25980","National Bureau of Economic Research Working Paper Series","http://www.nber.org/papers/w25980.pdf",NA,NA,NA,"Author contact info: Samuel Bazzi University of California, San Diego School of Global Policy and Strategy 9500 Gilman Drive, 0519 La Jolla, CA 92093 E-Mail: sbazzi@ucsd.edu  Robert Blair Brown University Department of Political Science Watson Institute for International  and Public Affairs Providence, RI 02912 E-Mail: robert_blair@brown.edu  Christopher Blattman Harris School of Public Policy The University of Chicago 1307 E 60th St Chicago, IL 60637 E-Mail: blattman@gmail.com  Oeindrila Dube University of Chicago Harris School of Public Policy 1307 E 60th St Chicago, IL 60637 E-Mail: odube@uchicago.edu  Matthew Gudgeon Department of Economics Tufts University 177 College Avenue Medford, MA 02155 United States E-Mail: matthew.gudgeon@tufts.edu  Richard Merton Peck Northwestern University 2211 Campus Dr Evanston, IL 60208 E-Mail: RichardPeck2021@u.northwestern.edu",2019,"http://www.nber.org/papers/w25980","No. 25980","Jun-19",NA,TRUE,FALSE,FALSE
"JOUR","Accounting standards prohibit internally created knowledge and organizational capital from being disclosed on firm balance sheets. As a result, balance sheets exhibit downward biases that have become exacerbated by increasing levels of intangible investments. To offset these biases, researchers must estimate the value of these off-balance sheet intangibles by capitalizing prior flows of R&D and SG&A. In doing so, a set of capitalization parameters must be assumed, i.e., the R&D depreciation rate and the fraction of SG&A that represents a long-lived asset. We estimate these parameters using market prices from firm exits and use them to capitalize intangibles for a comprehensive panel of firms from 1978-2017. We then use a series of validation tests to examine the performance of our intangible capital stocks versus those developed from commonly used parameters. On average, our estimates of intangible capital are 15% smaller than estimates from status-quo parameters while exhibiting larger variation across industry. Intangible capital stocks derived from exit price parameters outperform existing measures when explaining market enterprise values and identifying human capital risk. Adjusting book values with exit-based intangible capital stocks markedly attenuates well-documented biases in market-to-book and return on equity ratios while increasing the precision of the HML asset pricing factor. We conclude that our capitalization parameters create intangible stocks that perform equal to or better than status-quo measures in various applications.",NA,"measuring intangible capital with market prices","wang, sean","10.3386/w25960","National Bureau of Economic Research Working Paper Series","http://www.nber.org/papers/w25960.pdf",NA,NA,"presented at ""SI 2020 Conference on Research in Income and Wealth"", July 13-14, 2020","Author contact info: Michael Ewens Columbia Business School  665 W 130th St Henry Kravis Hall, 732   New York, NY 10027 E-Mail: me2731@columbia.edu  Ryan H. Peters Tulane University 7 McAlister Dr Suite 365 New Orleans, LA 70118 E-Mail: rpeters4@tulane.edu  Sean Wang Southern Methodist University 6425 Boaz Lane Dallas, TX 75205 E-Mail: seanwang@mail.smu.edu",2019,"http://www.nber.org/papers/w25960","No. 25960","Jun-19",NA,TRUE,FALSE,FALSE
"JOUR","This paper analyzes  weekly scanner data  collected for 108 groups at the county level  between 2006 and 2014. The data display multi-dimensional  weekly seasonal effects that are not exactly periodic but are cross-sectionally dependent.  Existing univariate procedures are imperfect and yield adjusted series that continue to display strong seasonality upon aggregation. We suggest augmenting the univariate adjustments with a  panel  data step that pools information across counties. Machine learning tools are then used to remove the within-year seasonal variations. A demand analysis of the  adjusted budget shares finds  three factors: one that is trending, and  two cyclical ones that are  well aligned with the level and change in consumer confidence. The effects of the Great Recession vary across  locations and product groups,  with  consumers  substituting towards home cooking away from non-essential goods. The adjusted data also reveal changes in spending to unanticipated shocks at the local level. The data are thus  informative about both local and aggregate economic conditions once the seasonal effects are removed. The two-step methodology  can be adapted to remove other types of nuisance variations provided that these variations  are cross-sectionally dependent.",NA,"a machine learning analysis of seasonal and cyclical sales in weekly scanner data","ng, serena","10.3386/w25899","National Bureau of Economic Research Working Paper Series","http://www.nber.org/papers/w25899.pdf","published as Rishab Guha, Serena Ng. ""A Machine Learning Analysis of Seasonal and Cyclical Sales in Weekly Scanner Data,"" in Katharine G. Abraham, Ron S. Jarmin, Brian Moyer, and Matthew D. Shapiro, editors, ""Big Data for Twenty-First-Century Economic Statistics"" University of Chicago Press (2022)",NA,"presented at ""CRIW Conference: Big Data for 21st Century Economic Statistics"", March 15-16, 2019","Author contact info: Rishab Guha Littauer Center, Harvard University, 1805 Cambridge St Cambridge, MA 02138 E-Mail: rishab_guha@g.harvard.edu  Serena Ng Department of Economics Columbia University 420 West 118th Street New York, NY 10027 Tel: 212/854-5488 Fax: 212/854-3735 E-Mail: Serena.Ng@columbia.edu",2019,"http://www.nber.org/papers/w25899","No. 25899","May-19",NA,TRUE,FALSE,FALSE
