"type","abstract","AB","title","author","doi","journal","link","M1","M2","tow","note","year","url","vol","access","endref","cond","nber_is_published","nber_in_ssrn"
"JOUR","We derive general, yet simple, sharp bounds on the size of the omitted variable bias for a broad class of causal parameters that can be identified as linear functionals of the conditional expectation function of the outcome. Such functionals encompass many of the traditional targets of investigation in causal inference studies, such as, for example, (weighted) average of potential outcomes, average treatment effects (including subgroup effects, such as the effect on the treated), (weighted) average derivatives, and policy effects from shifts in covariate distribution -- all for general, nonparametric causal models. Our construction relies on the Riesz-Frechet representation of the target functional. Specifically, we show how the bound on the bias depends only on the additional variation that the latent variables create both in the outcome and in the Riesz representer for the parameter of interest. Moreover, in many important cases (e.g, average treatment effects and avearage derivatives) the bound is shown to depend on easily interpretable quantities that measure the explanatory power of the omitted variables. Therefore, simple plausibility judgments on the maximum explanatory power of omitted variables (in explaining treatment and outcome variation) are sufficient to place overall bounds on the size of the bias. Furthermore, we use debiased machine learning to provide flexible and efficient statistical inference on learnable components of the bounds. Finally, empirical examples demonstrate the usefulness of the approach.","B","long story short: omitted variable bias in causal machine learning","syrgkanis, vasilis","10.3386/w30302","National Bureau of Economic Research Working Paper Series","http://www.nber.org/papers/w30302.pdf",NA,NA,NA,"Author contact info: Victor Chernozhukov Department of Economics Massachusetts Institute of Technology 77 Massachusetts Avenue Cambridge, Mass. 02139 E-Mail: vchern@mit.edu  Carlos Cinelli University of Washington  Department of Statistics  Box 354322  Seattle, WA 98195-4322 USA E-Mail: cinelli@uw.edu  Whitney Newey Department of Economics, E52-424 MIT 77 Massachusetts Avenue Cambridge, MA 02139 Tel: 617/253-6420 Fax: 617/253-1330 E-Mail: wnewey@mit.edu  Amit Sharma  No. 9, Lavelle Road  Bengaluru, Karn 560 001 India E-Mail: amshar@microsoft.com  Vasilis Syrgkanis 583 Alvarado Row Stanford, CA 94305 E-Mail: bsyrganis@gmail.com",2022,"http://www.nber.org/papers/w30302","No. 30302","Jul-22",NA,TRUE,FALSE,FALSE
"JOUR","Correspondence studies have found evidence of age discrimination in callback rates for older workers, but less is known about whether job advertisements can themselves shape the age composition of the applicant pool. We construct job ads for administrative assistant, retail, and security guard jobs, using language from real job ads collected in a prior large-scale correspondence study (Neumark et al., 2019a). We modify the job-ad language to randomly vary whether or not the job ad includes ageist language regarding age-related stereotypes. Our main analysis relies on machine learning methods to design job ads based on the semantic similarity between phrases in job ads and age-related stereotypes. In contrast to a correspondence study in which job searchers are artificial and researchers study the responses of real employers, in our research the job ads are artificial and we study the responses of real job searchers.  We find that job-ad language related to ageist stereotypes, even when the language is not blatantly or specifically age-related, deters older workers from applying for jobs. The change in the age distribution of applicants is large, with significant declines in the average and median age, the 75th percentile of the age distribution, and the share of applicants over 40. Based on these estimates and those from the correspondence study, and the fact that we use real-world ageist job-ad language, we conclude that job-ad language that deters older workers from applying for jobs can have roughly as large an impact on hiring of older workers as direct age discrimination in hiring.","B","help really wanted? the impact of age stereotypes in job ads on applications from older workers","neumark, david","10.3386/w30287","National Bureau of Economic Research Working Paper Series","http://www.nber.org/papers/w30287.pdf",NA,NA,"presented at ""Labor Studies Program Meeting"", April 28, 2023","Author contact info: Ian Burn University of Liverpool Department of Economics Chatham St, Liverpool L69 7ZH United Kingdom E-Mail: ian.burn@liverpool.ac.uk  Daniel Firoozi 500 East 9th Street Claremont, CA 91711 United States E-Mail: dfiroozi@cmc.edu  Daniel Ladd 3151 Social Sciences Plaza Irvine, Unit 92697 US E-Mail: dladd@uci.edu  David Neumark Department of Economics University of California, Irvine 3151 Social Science Plaza Irvine, CA  92697 Tel: 949-824-8496 Fax: 949/824-2182 E-Mail: dneumark@uci.edu",2022,"http://www.nber.org/papers/w30287","No. 30287","Jul-22",NA,TRUE,FALSE,FALSE
"JOUR","Much of the extant literature predicts market returns with “simple” models that use only a few parameters. Contrary to conventional wisdom, we theoretically prove that simple models severely understate return predictability compared to “complex” models in which the number of parameters exceeds the number of observations. We empirically document the virtue of complexity in US equity market return prediction. Our findings establish the rationale for modeling expected returns through machine learning.","B","the virtue of complexity in return prediction","zhou, kangying","10.3386/w30217","National Bureau of Economic Research Working Paper Series","http://www.nber.org/papers/w30217.pdf",NA,NA,NA,"Author contact info: Bryan T. Kelly Yale School of Management 165 Whitney Ave. New Haven, CT 06511 Tel: 203-432-2221 E-Mail: bryan.kelly@yale.edu  Semyon Malamud Swiss Finance Institute @ EPFL Quartier UNIL-Dorigny, Extranef 213 CH - 1015 Lausanne Switzerland E-Mail: semyon.malamud@epfl.ch  Kangying Zhou Yale University 165 Whitney Ave Ph.D. Suite New Haven, CT 06511 Tel: 8729047871 E-Mail: kangying.zhou@yale.edu",2022,"http://www.nber.org/papers/w30217","No. 30217","Jul-22",NA,TRUE,FALSE,FALSE
"JOUR","Recent advances in AI represent improvements in prediction. We examine how decision-making and risk management strategies change when prediction improves. The adoption of AI may cause substitution away from risk management activities used when rules are applied (rules require always taking the same action), instead allowing for decision-making (choosing actions based on the predicted state). We provide a formal model evaluating the impact of AI and how risk management, stakes, and inter-related tasks affect AI adoption. The broad conclusion is that AI adoption can be stymied by existing processes designed to address uncertainty. In particular, many processes are designed to enable coordinated decision-making among different actors in an organization. AI can make coordination even more challenging. However, when the cost of changing such processes falls, then the returns from AI adoption increase.","C","prediction machines, insurance, and protection: an alternative perspective on ai's role in production","goldfarb, avi","10.3386/w30177","National Bureau of Economic Research Working Paper Series","http://www.nber.org/papers/w30177.pdf",NA,NA,NA,"Author contact info: Ajay K. Agrawal Rotman School of Management University of Toronto 105 St. George Street Toronto, ON M5S 3E6 Tel: 416/946-0203 Fax: 416/978-5433 E-Mail: ajay.agrawal@rotman.utoronto.ca  Joshua S. Gans Rotman School of Management University of Toronto 105 St. George Street Toronto ON M5S 3E6 Tel: 416/978-3243 E-Mail: joshua.gans@rotman.utoronto.ca  Avi Goldfarb Rotman School of Management University of Toronto 105 St. George Street Toronto, ON M5S 3E6 Tel: 416/946-8604 Fax: 416/978-5433 E-Mail: agoldfarb@rotman.utoronto.ca",2022,"http://www.nber.org/papers/w30177","No. 30177","Jun-22",NA,TRUE,FALSE,FALSE
"JOUR","This paper shows that shootings are predictable enough to be preventable. Using arrest and victimization records for almost 644,000 people from the Chicago Police Department, we train a machine learning model to predict the risk of being shot in the next 18 months. Out-of-sample accuracy is strikingly high: of the 500 people with the highest predicted risk, almost 13 percent are shot within 18 months, a rate 128 times higher than the average Chicagoan. A central concern is that algorithms may “bake in” bias found in police data, overestimating risk for people likelier to interact with police conditional on their behavior. We show that Black male victims more often have enough police contact to generate predictions. But those predictions are not, on average, inflated; the demographic composition of predicted and actual shooting victims is almost identical. There are legal, ethical, and practical barriers to using these predictions to target law enforcement. But using them to target social services could have enormous preventive benefits: predictive accuracy among the top 500 people justifies spending up to $134,400 per person for an intervention that could cut the probability of being shot by half.","B","machine learning can predict shooting victimization well enough to help prevent it","kapustin, max","10.3386/w30170","National Bureau of Economic Research Working Paper Series","http://www.nber.org/papers/w30170.pdf",NA,NA,NA,"Author contact info: Sara B. Heller University of Michigan Department of Economics 611 Tappan Street, Lorch Hall Room 238 Ann Arbor, MI 48109 E-Mail: sbheller@umich.edu  Benjamin Jakubowski Courant Institute of Mathematical Sciences  251 Mercer St New York, NY 10012 E-Mail: benjamin.u.jakubowski@gmail.com  Zubin Jelveh 4130 Campus Dr College of Information Studies Dept. of Criminology and Criminal Justice College Park, MD 20742 United States Tel: 6465529775 E-Mail: zjelveh@umd.edu  Max Kapustin Department of Economics Brooks School of Public Policy Cornell University Martha Van Rensselaer Hall Ithaca, NY 14853 E-Mail: kapustin@cornell.edu",2022,"http://www.nber.org/papers/w30170","No. 30170","Jun-22",NA,TRUE,FALSE,FALSE
"JOUR","Targeting is a core element of anti-poverty program design, with benefits typically targeted to those most “deprived” in some sense (e.g., consumption, wealth). A large literature in economics examines how to best identify these households feasibly at scale, usually via proxy means tests (PMTs). We ask a different question, namely, whether targeting the most deprived has the greatest social welfare benefit: in particular, are the most deprived those with the largest treatment effects or do the “poorest of the poor” sometimes lack the circumstances and complementary inputs or skills to take full advantage of assistance? We explore this potential trade-off in the context of an NGO cash transfer program in Kenya, utilizing recent advances in machine learning (ML) methods (specifically, generalized random forests) to learn PMTs that target both a) deprivation and b) high conditional average treatment effects across several policy-relevant outcomes. We find that targeting solely on the basis of deprivation is generally not attractive in a social welfare sense, even when the social planner's preferences are highly redistributive. We show that a planner using simpler prediction models, based on OLS or less sophisticated ML approaches, could reach divergent conclusions. We discuss implications for the design of real-world anti-poverty programs at scale.","B","targeting impact versus deprivation","walker, michael w","10.3386/w30138","National Bureau of Economic Research Working Paper Series","http://www.nber.org/papers/w30138.pdf",NA,NA,NA,"Author contact info: Johannes Haushofer Department of Economics   National University of Singapore   1 Arts Link AS2 #06-02  Singapore 117570  Singapore  E-Mail: johannes.haushofer@nus.edu.sg  Paul Niehaus Department of Economics University of California, San Diego 9500 Gilman Drive #0508 La Jolla, CA 92093 Tel: 858/534-3190 Fax: 858/534-7040 E-Mail: pniehaus@ucsd.edu  Carlos Paramo Berkeley United States E-Mail: carlos.paramo@berkeley.edu  Edward Miguel Department of Economics University of California, Berkeley 530 Evans Hall #3880 Berkeley, CA 94720 Tel: 510/642-7162 Fax: 510/642-6615 E-Mail: emiguel@econ.berkeley.edu  Michael W. Walker University of California, Berkeley Center for Effective Global Action  251 Giannini Hall Berkeley, CA 94720 E-Mail: mwwalker@berkeley.edu",2022,"http://www.nber.org/papers/w30138","No. 30138","Jun-22",NA,TRUE,FALSE,FALSE
"JOUR","Irrigation in the Eastern US receives little attention compared to the West, but farmers in humid states of the US, traditionally reliant on rainfall, have more than tripled irrigation since 1978. We examine this trend in Illinois where there has been a nearly threefold increase in center pivot irrigation systems (CPIS) installations since 1988. Specifically, we analyze where and when CPIS installations occur and their benefits in terms of annual crop yield, irrigated acreage, crop selection, and reduction in drought-related insurance payouts. To do so, we create a novel data set derived from a deep learning model capable of automatically identifying the location of CPIS during drought years along with annual county level crop, weather, and insurance data. The results indicate CPIS installations in Illinois are significantly more common over alluvial aquifers after droughts. Additionally, counties with a higher presence of CPIS do not have higher average crop yields, a shift to more water intensive crops, or an expansion of cropland. However, in drought years CPIS presence does have a significant positive effect on corn yield and a significant negative effect on indemnity payments for both soybeans and corn. The results provide insights into an emerging trend of irrigation in humid regions, raising potential policy considerations for crop insurance and signaling a potential need to address water rights as demand increases.","B","center pivot irrigation systems as a form of drought risk mitigation in humid regions","smith, steven m","10.3386/w30093","National Bureau of Economic Research Working Paper Series","http://www.nber.org/papers/w30093.pdf","published as Daniel Cooley, Steven M. Smith. ""Center Pivot Irrigation Systems as a Form of Drought Risk Mitigation in Humid Regions,"" in Gary D. Libecap and Ariel Dinar, editors, ""American Agriculture, Water Resources, and Climate Change"" University of Chicago Press (2024)",NA,"presented at ""Economic Perspectives on Water Resources, Climate Change, and Agricultural Sustainability"", May 12-13, 2022","Author contact info: Daniel J. Cooley 1500 Illinois Street Golden, CO 80401 US E-Mail: cooley@mines.edu  Steven M. Smith Division of Economics and Business Colorado School of Mines Golden, CO 80401 E-Mail: ssmith1@mines.edu",2022,"http://www.nber.org/papers/w30093","No. 30093","May-22",NA,TRUE,FALSE,FALSE
"JOUR","This review considers the evolution of economic thinking on the relationship between digital technology and inequality across four decades, encompassing four related but intellectually distinct paradigms, which I refer to as the education race, the task polarization model, the automation-reinstatement race, and the era of Artificial Intelligence uncertainty. The nuance of economic understanding has improved across these epochs. Yet, traditional economic optimism about the beneficent effects of technology for productivity and welfare has eroded as understanding has advanced. Given this intellectual trajectory, it would be natural to forecast an even darker horizon ahead. I refrain from doing so because forecasting the “consequences” of technological change treats the future as a fate to be divined rather than an expedition to be undertaken. I conclude by discussing opportunities and challenges that we collectively face in shaping this future.","A","the labor market impacts of technological change: from unbridled enthusiasm to qualified optimism to vast uncertainty","autor, david","10.3386/w30074","National Bureau of Economic Research Working Paper Series","http://www.nber.org/papers/w30074.pdf",NA,NA,NA,"Author contact info: David Autor Department of Economics, E52-438 Massachusetts Institute of Technology 77 Massachusetts Avenue Cambridge, MA 02139 Tel: 617/258-7698 Fax: 617/253-1330 E-Mail: dautor@mit.edu",2022,"http://www.nber.org/papers/w30074","No. 30074","May-22",NA,TRUE,FALSE,FALSE
"JOUR","Artificial Intelligence is a powerful new technology that will likely have large impacts on the size, direction and composition of international trade flows. Yet almost nothing is known empirically about this. One AI-enabled set of services that can be tracked resides in the palm of our hands: the Mobile Apps used by half the world's population. To analyze the impact of AI on international trade in mobile App services we merge 2014-2020 data on international downloads of mobile Apps with data on the AI patents held by each App's parent company. From this we build a measure of AI deployment. We instrument AI deployment using cost-shifters from the theory of comparative advantage: Countries with a large stock of AI expertise will have a comparative advantage producing AI-intensive Apps. We show the following IV results. (1) Bilateral Trade: AI deployment increases App downloads by a factor of six. (2) Variety Effects: AI deployment doubles the number of exported App varieties. (3) Creative Destruction: AI deployment increases creative destruction (entry and exit of Apps) and in 2020 the net effect was an increase in welfare of between 2.5% and 10.6%.","A","ai, trade and creative destruction: a first look","sun, ruiqi","10.3386/w29980","National Bureau of Economic Research Working Paper Series","http://www.nber.org/papers/w29980.pdf",NA,NA,NA,"Author contact info: Daniel Trefler Rotman School of Management University of Toronto 105 St. George Street Toronto, ON M5S 3E6 Tel: 416/946-7945 Fax: 416/978-5433 E-Mail: dtrefler@rotman.utoronto.ca  Ruiqi Sun Rotman School of Management  105 St. George Street Toronto, ON M5S3E6 Canada Tel: 4379890196 E-Mail: sunrq.17@pbcsf.tsinghua.edu.cn",2022,"http://www.nber.org/papers/w29980","No. 29980","Apr-22",NA,TRUE,FALSE,FALSE
"JOUR","Most of the rise in overall earnings inequality is accounted for by rising between-industry dispersion from ten percent of 4-digit NAICS industries. These thirty industries are clustered especially in high-paying high-tech and low-paying retail sectors. The rise of employment in mega firms is concentrated in the industries that dominate rising earnings inequality. Earnings differentials for the mega firms relative to small firms decline in the low-paying industries but increase in the high-paying industries. A critical component accounting for the rising dispersion in the top thirty industries is an increasing covariance between industry premia and worker characteristics associated with high earnings.","A","industries, mega firms, and increasing inequality","spletzer, james","10.3386/w29920","National Bureau of Economic Research Working Paper Series","http://www.nber.org/papers/w29920.pdf",NA,NA,"presented at ""Wage Dynamics in the 21st Century Conference"", May 20-21, 2021","Author contact info: John C. Haltiwanger Department of Economics University of Maryland College Park, MD 20742 Tel: 301/405-3504 Fax: 301/405-3542 E-Mail: haltiwan@econ.umd.edu  Henry R. Hyatt Center for Economic Studies U.S. Census Bureau 4600 Silver Hill Road Washington, DC 20233 E-Mail: henry.r.hyatt@census.gov  James Spletzer Center for Economic Studies U.S. Census Bureau 4600 Silver Hill Road Washington, DC 20233 E-Mail: James.R.Spletzer@gmail.com",2022,"http://www.nber.org/papers/w29920","No. 29920","Apr-22",NA,TRUE,FALSE,FALSE
"JOUR","How does the publication of patents affect innovation? We answer this question by exploiting a large-scale natural experiment—the passage of the American Inventor's Protection Act of 1999 (AIPA)—that accelerated the public disclosure of most U.S. patents by two years. We obtain causal estimates by comparing U.S. patents subject to the law change with “twin” European patents which were not. After AIPA's enactment, U.S. patents receive more and faster follow-on citations, indicating an increase in technology diffusion. Technological overlap increases between distant but related patents and decreases between highly similar patents, and patent applications are less likely to be abandoned post-AIPA, suggesting a reduction in duplicative R&D. Firms exposed to one standard deviation longer patent grant delays increased their R&D investment by 4% after AIPA. These findings are consistent with our theoretical framework in which AIPA provisions news shocks about related technologies to follow-on inventors and thus alters their innovation decisions.","B","patent publication and innovation","zhu, chenqi","10.3386/w29770","National Bureau of Economic Research Working Paper Series","http://www.nber.org/papers/w29770.pdf",NA,NA,NA,"Author contact info: Deepak Hegde Stern School of Business New York University 40 West Street Suite 722 New York, NY 10012 Tel: 212-998-0674 E-Mail: dhegde@stern.nyu.edu  Kyle F. Herkenhoff University of Minnesota Department of Economics 4-101 Hanson Hall 1925 Fourth Street South Minneapolis, MN 55455 Tel: 925/360-7623 E-Mail: kfh@umn.edu  Chenqi Zhu 4293 Pereira Dr Irvine,, CA 92697 E-Mail: chenqiz1@uci.edu",2022,"http://www.nber.org/papers/w29770","No. 29770","Feb-22",NA,TRUE,FALSE,FALSE
"JOUR","General purpose technologies (GPTs) push out the production possibility frontier and are of strategic importance to managers and policymakers. While theoretical models that explain the characteristics, benefits, and approaches to create and capture value from GPTs have advanced significantly, empirical methods to identify GPTs are lagging. The handful of available attempts are typically context specific and rely on hindsight. For managers deciding on technology strategy, it means that the classification, when available, comes too late. We propose a more universal approach of assessing the GPT likelihood of emerging technologies using data from online job postings. We benchmark our approach against prevailing empirical GPT methods that exploit patent data and provide an application on a set of emerging technologies. Our application exercise suggests that a cluster of technologies comprised of machine learning and related data science technologies is relatively likely to be GPT.","B","could machine learning be a general purpose technology? a comparison of emerging technologies using data from online job postings","teodoridis, florenta","10.3386/w29767","National Bureau of Economic Research Working Paper Series","http://www.nber.org/papers/w29767.pdf",NA,NA,NA,"Author contact info: Avi Goldfarb Rotman School of Management University of Toronto 105 St. George Street Toronto, ON M5S 3E6 Tel: 416/946-8604 Fax: 416/978-5433 E-Mail: agoldfarb@rotman.utoronto.ca  Bledi Taska E-Mail: bt540@nyu.edu  Florenta Teodoridis University of Southern California  Marshall School of Business 701 Exposition Blvd, HOH 503 Los Angeles, CA 90089 E-Mail: florenta.teodoridis@marshall.usc.edu",2022,"http://www.nber.org/papers/w29767","No. 29767","Feb-22",NA,TRUE,FALSE,FALSE
"JOUR","We show, using machine learning, that fund characteristics can consistently differentiate high from low-performing mutual funds, as well as identify funds with net-of-fees abnormal returns. Fund momentum and fund flow are the most important predictors of future risk-adjusted fund performance, while characteristics of the stocks that funds hold are not predictive. Returns of predictive long-short portfolios are higher following a period of high sentiment or a good state of the macro-economy. Our estimation with neural networks enables us to uncover novel and substantial interaction effects between sentiment and both fund flow and fund momentum.","B","machine-learning the skill of mutual fund managers","van nieuwerburgh, stijn","10.3386/w29723","National Bureau of Economic Research Working Paper Series","http://www.nber.org/papers/w29723.pdf",NA,NA,"presented at ""Big Data and High-Performance Computing for Financial Economics"", July 16, 2022","Author contact info: Ron Kaniel University of Rochester Simon School of Business 500 Wilson BLVD Carol Simon Hall Box 270100 (Room CS3-312) Tel: 585-275-1836 E-Mail: ron.kaniel@simon.rochester.edu  Zihan Lin Stanford University 475 Via Ortega Suite B060 Stanford, CA 94305 E-Mail: zihanl@stanford.edu  Markus Pelger Stanford University Department of Management Science & Engineering 312 Huang Engineering Center Stanford, CA 94305 E-Mail: mpelger@stanford.edu  Stijn Van Nieuwerburgh Columbia University Graduate School of Business Kravis Hall, office 796 665 West 130th Street New York, NY 10027 E-Mail: svnieuwe@gsb.columbia.edu",2022,"http://www.nber.org/papers/w29723","No. 29723","Feb-22",NA,TRUE,FALSE,FALSE
