"type","abstract","AB","title","author","doi","journal","link","M1","M2","tow","note","year","url","vol","access","endref","cond","nber_is_published","nber_in_ssrn"
"JOUR","“Consumer-Directed” Health Plans (CDHPs) combine high deductibles with personal medical accounts and are intended to reduce health care spending through greater patient cost sharing. Prior research shows that CDHPs reduce spending in the first year. However, there is little research on the impact of CDHPs over the longer term.  We add to this literature by using data from 13 million individuals in 54 large US firms to estimate the effects of a firm offering CDHPs on health care spending up to three years post offer. We use a difference-in-differences analysis and to further strengthen identification, we balance observables within firm, over time by developing weights through a machine learning algorithm. We find that spending is reduced for those in firms offering CDHPs in all three years post. The reductions are driven by spending decreases in outpatient care and pharmaceuticals, with no evidence of increases in emergency department or inpatient care.",NA,"do “consumer-directed” health plans bend the cost curve over time?","sood, neeraj","10.3386/w21031","National Bureau of Economic Research Working Paper Series","http://www.nber.org/papers/w21031.pdf",NA,"featured in NBER digest on 2015-07-09",NA,"Author contact info: Amelia Haviland H. John Heinz III College Carnegie Mellon University 5000 Forbes Ave. Pittsburgh, PA 15213 E-Mail: haviland@cmu.edu  Matthew D. Eisenberg Department of Health Policy and Management Johns Hopkins University 624 N Broadway Room 406 Baltimore, MD 21205 E-Mail: eisenberg@jhu.edu  Ateev Mehrotra Harvard Medical School 180 Longwood Ave. Boston, MA 02115 E-Mail: Mehrotra@hcp.med.harvard.edu  Peter J. Huckfeldt Division of Health Policy and Management School of Public Health University of Minnesota 420 Delaware Street Southeast Mmc729 Minneapolis, MN 55455 E-Mail: huckfeld@umn.edu  Neeraj Sood Schaeffer Center for Health Policy and Economics Sol Price School of Public Policy University of Southern California University Park Campus Los Angeles CA 90089 Tel: 310/393-0411 Fax: 310/260-8156 E-Mail: nsood@healthpolicy.usc.edu",2015,"http://www.nber.org/papers/w21031","No. 21031","Mar-15",NA,TRUE,FALSE,FALSE
"JOUR","We survey and apply several techniques from the statistical and computer science literature to the problem of demand estimation. We derive novel asymptotic properties for several of these models. To improve out-of-sample prediction accuracy and obtain parametric rates of convergence, we propose a method of combining the underlying models via linear regression. Our method has several appealing features: it is robust to a large number of potentially-collinear regressors; it scales easily to very large data sets; the machine learning methods combine model selection and estimation; and the method can flexibly approximate arbitrary non-linear functions, even when the set of regressors is high dimensional and we also allow for fixed effects.  We illustrate our method using a standard scanner panel data set to estimate promotional lift and find that our estimates are considerably more accurate in out of sample predictions of demand than some commonly used alternatives. While demand estimation is our motivating application, these methods are likely to be useful in other microeconometric problems.",NA,"demand estimation with machine learning and model combination","yang, miaoyu","10.3386/w20955","National Bureau of Economic Research Working Paper Series","http://www.nber.org/papers/w20955.pdf",NA,NA,NA,"Author contact info: Patrick L. Bajari E-Mail: pbajari@keystonestrategy.com  Denis Nekipelov Department of Economics University of Virginia 254 Monroe Hall Charlottesville, VA 22904-4182 E-Mail: dn4w@virginia.edu  Stephen P. Ryan Olin Business School Washington University in St. Louis Campus Box 1133 One Brookings Drive St. Louis, MO 63130 E-Mail: stephen.p.ryan@wustl.edu  Miaoyu Yang Department of Economics, Univ. of Washington 305 Savery Hall, Box 353330 Seattle, WA 98195-3330 E-Mail: yangmiao@uw.edu",2015,"http://www.nber.org/papers/w20955","No. 20955","Feb-15",NA,TRUE,FALSE,FALSE
"JOUR","Recent evaluations of traditional microfinance loans have found no significant impacts on borrower incomes or productive activities. We examine whether this can be remedied by (a) modifying loan features to facilitate financing of working capital needs of farmers, and (b) delegating selection of borrowers for individual liability loans to local trader-lender agents incentivized by repayment-based commissions. We conduct a field experiment in West Bengal where this design (called TRAIL) was offered in randomly selected villages. In remaining villages a more traditional design (called GBL) was offered, wherein five-member groups applied for joint liability loans with terms otherwise similar to TRAIL loans. TRAIL loans increased cultivation of potatoes (the major cash crop in the region) and farm incomes by 17–21%, whereas GBL loans had insignificant and highly dispersed effects. We argue this was because TRAIL agents selected borrowers that were low-risk and highly productive, whereas the GBL scheme attracted farmers that were riskier on average and highly heterogeneous in terms of productivity. TRAIL loans also achieved higher repayment and take-up rates, and lower administrative costs.",NA,"financing smallholder agriculture: an experiment with agent-intermediated microloans in india","visaria, sujata","10.3386/w20709","National Bureau of Economic Research Working Paper Series","http://www.nber.org/papers/w20709.pdf",NA,"featured in NBER digest on 2015-02-26",NA,"Author contact info: Pushkar Maitra Monash University Department of Economics Clayton Campus, VIC 3800 Australia E-Mail: Pushkar.Maitra@monash.edu  Sandip Mitra Sandip Mitra Sampling and Official Statistics Unit Indian Statistical Institute, 203 BT Road Kolkata 700108 India E-Mail: sandipisi@gmail.com  Dilip Mookherjee Department of Economics Boston University 270 Bay State Road Boston, MA 02215 Tel: 617/353-4392 Fax: 617/353-4143 E-Mail: dilipm@bu.edu  Alberto Motta University of New South Wales School of Economics Sydney 2052 Room 3124 Australia Tel: +61 293859771    Fax: +61293136337 E-Mail: motta@unsw.edu.au  Sujata Visaria Bayes Business School City University of London 106 Bunhill Row  London EC1Y 8TZ United Kingdom E-Mail: sujata.visaria@city.ac.uk",2014,"http://www.nber.org/papers/w20709","No. 20709","Nov-14",NA,TRUE,FALSE,FALSE
"JOUR","We compare the performance of maximum likelihood (ML) and simulated method of moments (SMM) estimation for dynamic discrete choice models. We construct and estimate a simplified dynamic structural model of education that captures some basic features of educational choices in the United States in the 1980s and early 1990s. We use estimates from our model to simulate a synthetic dataset and assess the ability of ML and SMM to recover the model parameters on this sample. We investigate the performance of alternative tuning parameters for SMM.",NA,"estimation of dynamic discrete choice models by maximum likelihood and the simulated method of moments","mosso, stefano","10.3386/w20622","National Bureau of Economic Research Working Paper Series","http://www.nber.org/papers/w20622.pdf",NA,NA,NA,"Author contact info: Phillipp Eisenhauer University of Chicago E-Mail: eisenhauer@uchicago.edu  James J. Heckman Center for the Economics of Human Development University of Chicago 1126 East 59th Street Chicago, IL 60637 Tel: 773/702-0634 Fax: 773/702-8490 E-Mail: jjh@uchicago.edu  Stefano Mosso Department of Economics The University of Chicago 1126 E. 59th Street Chicago  IL  60637 E-Mail: smosso@uchicago.edu",2014,"http://www.nber.org/papers/w20622","No. 20622","Oct-14",NA,TRUE,FALSE,FALSE
"JOUR","This paper examines the distributional implications of introducing additional means testing of Social Security benefits where proceeds are used to help balance Social Security's finances. Benefits of the top quarter of households ranked according to the relevant measure of means are reduced using a modified version of the Social Security Windfall Elimination Provision (WEP). The replacement rate in the first bracket of the benefit formula, determining the Primary Insurance Amount (PIA), would be reduced from 90 percent to 40 percent of Average Indexed Monthly Earnings (AIME). Four measures of means are considered: total wealth; an annualized measure of AIME; the wealth value of pensions; and a measure of average indexed lifetime W2 earnings. The empirical analysis is based on data from the Health and Retirement Study. These means tests would reduce total lifetime household benefits by 7 to 9 percentage points. We find that the basis for means testing Social Security makes a substantial difference as to which households have their benefits reduced, and that different means tests may have different effects on the benefits of families in similar circumstance. We also find that the measure of means used to evaluate the effects of a means test makes a considerable difference as to how one would view the effects of the means test on the distribution of benefits.",NA,"distributional effects of means testing social security: an exploratory analysis","tabatabai, nahid","10.3386/w20546","National Bureau of Economic Research Working Paper Series","http://www.nber.org/papers/w20546.pdf",NA,NA,NA,"Author contact info: Alan L. Gustman Department of Economics Dartmouth College Hanover, NH  03755-3514 Tel: 603/646-2641 Fax: 603/646-2122 E-Mail: ALAN.L.GUSTMAN@DARTMOUTH.EDU  Thomas L. Steinmeier Department of Economics Texas Tech University Lubbock, TX 79409 E-Mail: thomas.steinmeier@ttu.edu  Nahid Tabatabai Department of Economics Dartmouth College Hanover, NH 03755 E-Mail: Nahid.Tabatabai@dartmouth.edu",2014,"http://www.nber.org/papers/w20546","No. 20546","Oct-14",NA,TRUE,FALSE,FALSE
"JOUR","Forecasts for the two or three years after mid-2014 have converged on growth rates of real GDP in the range of 3.0 to 3.5 percent, a major stepwise increase from realized growth of 2.1 percent between mid-2009 and mid-2014.  However, these forecasts are based on the demand for goods and services.  Less attention has been paid to how the accelerated growth of real GDP will be supplied.  Will the unemployment rate, which has declined at roughly one percent per year, decline even faster from 6.1 percent in June, 2014 to 3.0 percent or below in 2017?  Will the supply-side support for the demand-side optimism be provided instead by a major rebound of productivity growth from the average of 1.2 percent over the past decade and 0.6 percent for the last four years, or perhaps by a reversal of the minus 0.8 percent growth rate since 2007 of the labor-force participation rate?  The paper develops a new and surprisingly simple method of calculating the growth rate of potential GDP over the next decade and concludes that projections of potential output growth for the same decade in the most recent reports of the Congressional Budget Office (CBO) are much too optimistic.  If the projections in this paper are close to the mark, the level of potential GDP in 2024 will be almost 10 percent below the CBO's current forecast.  Further, the new potential GDP series implies that the debt/GDP ratio in 2024 will be closer to 87 percent than the CBO's current forecast of 78 percent.      This paper also has profound implications for the Federal Reserve.  The unemployment rate has declined rapidly, particularly within the last year.  Faster real GDP growth will accelerate the decline in the unemployment rate and soon reduce it beyond any estimate of the constant-inflation NAIRU, even if productivity growth experiences a rebound and the labor force participation rate stabilizes.  The macro economy is on a collision course between demand-side optimism and supply-side pessimism.",NA,"a new method of estimating potential real gdp growth: implications for the labor market and the debt/gdp ratio","gordon, robert j","10.3386/w20423","National Bureau of Economic Research Working Paper Series","http://www.nber.org/papers/w20423.pdf",NA,NA,NA,"Author contact info: Robert J. Gordon Department of Economics Northwestern University Evanston,  IL 60208-2600 Tel: 847/491-3616 Fax: 847/869-7343 E-Mail: rjg@northwestern.edu",2014,"http://www.nber.org/papers/w20423","No. 20423","Aug-14",NA,TRUE,FALSE,FALSE
"JOUR","Clusters are geographic concentrations of industries related by knowledge, skills, inputs, demand, and/or other linkages. A growing body of empirical literature has shown the positive impact of clusters on regional and industry performance, including job creation, patenting, and new business formation. There is an increasing need for cluster-based data to support research, facilitate comparisons of clusters across regions, and support policymakers and practitioners in defining regional strategies. This paper develops a novel clustering algorithm that systematically generates and assesses sets of cluster definitions (i.e., groups of closely related industries). We implement the algorithm using 2009 data for U.S. industries (6-digit NAICS), and propose a new set of benchmark cluster definitions that incorporates measures of inter-industry linkages based on co-location patterns, input-output links, and similarities in labor occupations. We also illustrate the algorithm's ability to compare alternative sets of cluster definitions by evaluating our new set against existing sets in the literature. We find that our proposed set outperforms other methods in capturing a wide range of inter-industry linkages, including grouping industries within the same 3-digit NAICS.",NA,"defining clusters of related industries","stern, scott","10.3386/w20375","National Bureau of Economic Research Working Paper Series","http://www.nber.org/papers/w20375.pdf",NA,NA,NA,"Author contact info: Mercedes Delgado Copenhagen Business School Department of Strategy and Innovation (SI) Kilevej 14, 2 Frederiksberg DK-2000 Denmark E-Mail: md.si@cbs.dk  Michael E. Porter Harvard University Institute for Strategy and Competitiveness Ludcke House Harvard Business School Soldiers Field Road Boston, MA 02163 E-Mail: mporter@hbs.edu  Scott Stern MIT Sloan School of Management 100 Main Street, E62-476 Cambridge, MA 02142 Tel: 617/253-3053 Fax: 617/253-2660 E-Mail: sstern@mit.edu",2014,"http://www.nber.org/papers/w20375","No. 20375","Aug-14",NA,TRUE,FALSE,FALSE
"JOUR","I introduce a model of undirected dyadic link formation which allows for assortative matching on observed agent characteristics (homophily) as well as unrestricted agent level heterogeneity in link surplus (degree heterogeneity). Like in fixed effects panel data analyses, the joint distribution of observed and unobserved agent-level characteristics is left unrestricted. Two estimators for the (common) homophily parameter, `beta_0`, are developed and their properties studied under an asymptotic sequence involving a single network growing large. The first, tetrad logit (TL), estimator conditions on a sufficient statistic for the degree heterogeneity. The second, joint maximum likelihood (JML), estimator treats the degree heterogeneity ` {A_(i0)}_(i=1)^N` as additional (incidental) parameters to be estimated. The TL estimate is consistent under both sparse and dense graph sequences, whereas consistency of the JML estimate is shown only under dense graph sequences.",NA,"an econometric model of link formation with degree heterogeneity","graham, bryan s","10.3386/w20341","National Bureau of Economic Research Working Paper Series","http://www.nber.org/papers/w20341.pdf",NA,NA,NA,"Author contact info: Bryan S. Graham University of California - Berkeley 530 Evans Hall #3880 Berkeley, CA 94720-3880 Tel: (510) 642 4752 E-Mail: bgraham@econ.berkeley.edu",2014,"http://www.nber.org/papers/w20341","No. 20341","Jul-14",NA,TRUE,FALSE,FALSE
"JOUR","21 states and the District of Columbia currently have laws that permit marijuana use for medical purposes, often termed medical marijuana laws (MMLs). We tested the effects of MMLs adopted in seven states between 2004 and 2011 on adolescent and adult marijuana, alcohol, and hard drug use. We employed a restricted-access version of the National Survey on Drug Use and Health (NSDUH) micro-level data with geographic identifiers. For those 21 and older, we found that MMLs led to a relative increase in the probability of marijuana use of 16 percent, an increase in marijuana use frequency of 12-17 percent, and an increase in the probability of marijuana abuse/dependence of 15-27 percent. For those 12-20 years old, we found a relative increase in marijuana use initiation of 5-6 percent. Among those aged 21 or above, MMLs increased the frequency of binge drinking by 6-9 percent, but MMLs did not affect drinking behavior among those 12-20 years old. MMLs had no discernible impact on hard drug use in either age group. Taken together, MML implementation increases marijuana use mainly among those over 21, where there is also a spillover effect of increased binge drinking, but there is no evidence of spillovers to other substance use.",NA,"the effect of medical marijuana laws on marijuana, alcohol, and hard drug use","cummings, janet r","10.3386/w20085","National Bureau of Economic Research Working Paper Series","http://www.nber.org/papers/w20085.pdf",NA,"featured in NBER digest on 2014-09-24",NA,"Author contact info: Hefei Wen Emory University Department of Health Management and Policy 1518 Clifton Rd Atlanta GA, 30322 E-Mail: hwen2@emory.edu  Jason Hockenberry Yale School of Public Health 60 College St. New Haven, CT 06510 E-Mail: jason.hockenberry@yale.edu  Janet R. Cummings Emory University Department of Health Policy    and Management 1518 Clifton Rd Atlanta GA, 30322 E-Mail: jrcummi@emory.edu",2014,"http://www.nber.org/papers/w20085","No. 20085","May-14",NA,TRUE,FALSE,FALSE
"JOUR","Asset pricing models such as the conditional CAPM are typically estimated with MLE using a monthly or quarterly horizon with data sampled to match the horizon even though daily data are available. We develop an overlapping data inference methodology (ODIN) that uses all of the data while maintaining the monthly or quarterly forecasting period, and we apply it to the conditional CAPM. Our approach recognizes that the first order conditions of MLE can be used as orthogonality conditions of GMM. Using historical data, we find considerable differences in the estimates from the non-overlapping samples that begin on different days.",NA,"estimating the risk-return trade-off with overlapping data inference","hodrick, robert j","10.3386/w19969","National Bureau of Economic Research Working Paper Series","http://www.nber.org/papers/w19969.pdf",NA,NA,NA,"Author contact info: Esben Hedegaard W. P. Carey School of Business Arizona State University 400 E. Lemon Street, BAC 518 Tempe, AZ 85287-3906 E-Mail: esben.hedegaard@stern.nyu.edu  Robert J. Hodrick 379 Greenoaks Drive Atherton, CA 94027-2115 United States Tel: 3478521556 E-Mail: rh169@columbia.edu",2014,"http://www.nber.org/papers/w19969","No. 19969","Mar-14",NA,TRUE,FALSE,FALSE
"JOUR","Modern growth theory suggests that more than 3/4 of growth since 1950 reflects rising educational attainment and research intensity. As these transition dynamics fade, U.S. economic growth is likely to slow at some point. However, the rise of China, India, and other emerging economies may allow another few decades of rapid growth in world researchers. Finally, and more speculatively, the shape of the idea production function introduces a fundamental uncertainty into the future of growth. For example, the possibility that artificial intelligence will allow machines to replace workers to some extent could lead to higher growth in the future.",NA,"the future of u.s. economic growth","jones, charles i","10.3386/w19830","National Bureau of Economic Research Working Paper Series","http://www.nber.org/papers/w19830.pdf",NA,NA,NA,"Author contact info: John Fernald Federal Reserve Bank of San Francisco  Economic Research Department  Mailstop 1130  101 Market Street, 11th floor  San Francisco, CA 94105 Tel: 415-974-2135  Fax: 815-642-0515 E-Mail: fernaldjg@gmail.com  Charles I. Jones Graduate School of Business Stanford University 655 Knight Way Stanford, CA 94305-4800 Tel: 650/725-9265 Fax: 650/725-0468 E-Mail: chad.jones@stanford.edu",2014,"http://www.nber.org/papers/w19830","No. 19830","Jan-14",NA,TRUE,FALSE,FALSE
"JOUR","The Affordable Care Act (ACA) will dramatically alter health insurance markets and the sources through which individuals obtain coverage. As the ACA is implemented, it is essential to monitor the intended and the unintended consequences of these regulations. To evaluate the changes in health insurance markets linked to the ACA, it is critical to consistently measure the size and structure of health insurance markets, as well as the performance of participating health insurers, prior to and post-ACA. In this paper we discuss challenges of describing the size, structure, and performance of the individual and small group markets. Next, we discuss improvements in data availability starting in 2010 to address some of these concerns. Finally, using data from the National Association of Insurance Commissioners (NAIC), we evaluate insurance market structure and performance during 2010-2012, focusing on enrollment, the number of participating insurers, premiums, claims spending, MLR, and administrative expenses.",NA,"going into the affordable care act: measuring the size, structure and performance of the individual and small group markets for health insurance","feldman, roger","10.3386/w19719","National Bureau of Economic Research Working Paper Series","http://www.nber.org/papers/w19719.pdf","published as Pinar Karaca-Mandic, Jean M. Abraham, Kosali Simon, Roger Feldman. ""Going into the Affordable Care Act: Measuring the Size, Structure, and Performance of the Individual and Small Group Markets for Health Insurance,"" in Ana Aizcorbe, Colin Baker, Ernst R. Berndt, and David M. Cutler, editors, ""Measuring and Modeling Health Care Costs"" University of Chicago Press (2018)",NA,"presented at ""Measuring and Modeling Health Care Costs"", October 18-19, 2013","Author contact info: Pinar Karaca-Mandic Carlson School of Management University of Minnesota 321 19th Avenue South Room 3-287 Minneapolis, MN  55455 Tel: (612)-624-8953 E-Mail: pkmandic@umn.edu  Jean Marie Abraham  Kosali I. Simon O’Neill School of Public and Environmental Affairs Indiana University 1315 East Tenth Street Bloomington, IN 47405-1701 Tel: (812) 856-3850 E-Mail: simonkos@indiana.edu  Roger Feldman Health Policy and Management School of Public Health University of Minnesota Mayo Mail Code 729 420 Delware Street  S.E. Minneapolis, MN 55455-0392 E-Mail: feldm002@umn.edu",2013,"http://www.nber.org/papers/w19719","No. 19719","Dec-13",NA,TRUE,FALSE,FALSE
